{
  "id": "17b7a176-2320-4d37-8756-370dde276b4d",
  "type": "notarised_evidence",
  "plan_id": "33327878-9b3c-4271-89d0-dbd3f534f967",
  "agent": "bluemagma-agent",
  "action": "read:iam:list-mfa-status",
  "in_policy": true,
  "policy_reason": "matched scope read:iam:*",
  "evidence_hash_sha512": "fce460a5fae823a034f90f26846fd565d268c0f2980d0f0e7321bc2b71c5e703925a507fce5612aa6e7975af6453bf272c51121a5431861460f8bd2add1942e4",
  "evidence": {
    "control": "SOC2 CC6.3",
    "tool": "list_mfa_status",
    "args": {},
    "output": {
      "region": "us-east-1",
      "source": "aws-iam-api",
      "mfa_status": {
        "alice": true,
        "bob": false
      }
    }
  },
  "observed_at": "2026-04-21T18:27:25.277150+00:00",
  "aiuc_controls": [
    "E015",
    "D003",
    "B001"
  ],
  "key_id": "50e800a98073deac",
  "agent_key_id": "",
  "policy_hash": "35e94cd5dce46628fbde88b7b1b8447c1c8a85b22e9f48d04e912b0778914a0b",
  "session_id": "34338b1c-fbde-42d1-9a1f-3f2bc17abfa7",
  "session_trajectory": [
    {
      "action": "read:iam:list-users",
      "agent": "bluemagma-agent",
      "in_policy": true,
      "observed_at": "2026-04-21T18:27:22.179065+00:00"
    },
    {
      "action": "read:iam:list-mfa-status",
      "agent": "bluemagma-agent",
      "in_policy": true,
      "observed_at": "2026-04-21T18:27:25.277150+00:00"
    }
  ],
  "previous_receipt_hash": "7a4c390942a6ab9fb2f19ce899dd0b937421e55734274b362ea95f9868e8b541",
  "plan_signature": "c109871a1204ab5feb94f010d42b2608f5f5a864dd2e6b76c1708651bf0462692a924b9b7555e4bad0ab83c9e392c3e868557734a10e2593e527290b179da60d",
  "signature": "2af479f5149458859f9aa7be2b513e0474a10171afbadab2cd35e042301aad97410a2e11929a2ca5318d182b9a43499da2efc3204b120ef810cb1ede4c874205"
}