{
  "id": "610d8ede-9407-4479-9ce7-55cca43bb3c9",
  "type": "notarised_evidence",
  "plan_id": "33327878-9b3c-4271-89d0-dbd3f534f967",
  "agent": "bluemagma-agent",
  "action": "change:iam:attach-policy-narrow:bob-readonlyaccess",
  "in_policy": true,
  "policy_reason": "matched scope change:iam:attach-policy-narrow:*",
  "evidence_hash_sha512": "1ebb835c195dbdb72f16a72d801d80daade3b817a0239f1ec240322948213e5b542abb23f8420e468e0038466b1dd2c2cb2e15b2ddce441e3c79535c92756b8d",
  "evidence": {
    "control": "SOC2 D003.4 \u00b7 D003.1 \u00b7 E015",
    "tool": "attach_iam_policy_narrow",
    "args": {
      "user": "bob",
      "policy": "ReadOnlyAccess",
      "approver": "security-lead@acme.com"
    },
    "output": {
      "attached": true,
      "scope": "narrow",
      "user": "bob",
      "policy": "ReadOnlyAccess",
      "approver": "security-lead@acme.com"
    }
  },
  "observed_at": "2026-04-21T18:27:35.771914+00:00",
  "aiuc_controls": [
    "E015",
    "D003",
    "B001"
  ],
  "key_id": "50e800a98073deac",
  "agent_key_id": "",
  "policy_hash": "35e94cd5dce46628fbde88b7b1b8447c1c8a85b22e9f48d04e912b0778914a0b",
  "session_id": "34338b1c-fbde-42d1-9a1f-3f2bc17abfa7",
  "session_trajectory": [
    {
      "action": "read:iam:list-users",
      "agent": "bluemagma-agent",
      "in_policy": true,
      "observed_at": "2026-04-21T18:27:22.179065+00:00"
    },
    {
      "action": "read:iam:list-mfa-status",
      "agent": "bluemagma-agent",
      "in_policy": true,
      "observed_at": "2026-04-21T18:27:25.277150+00:00"
    },
    {
      "action": "read:s3:list-buckets",
      "agent": "bluemagma-agent",
      "in_policy": true,
      "observed_at": "2026-04-21T18:27:28.383012+00:00"
    },
    {
      "action": "change:iam:attach-policy",
      "agent": "bluemagma-agent",
      "in_policy": false,
      "observed_at": "2026-04-21T18:27:32.006387+00:00"
    },
    {
      "action": "change:iam:attach-policy-narrow:bob-readonlyaccess",
      "agent": "bluemagma-agent",
      "in_policy": true,
      "observed_at": "2026-04-21T18:27:35.771914+00:00"
    }
  ],
  "previous_receipt_hash": "caafc9efda1ed05b5e9801b15f6158f1072ff0f0e2451bdee490f35611018a12",
  "plan_signature": "c109871a1204ab5feb94f010d42b2608f5f5a864dd2e6b76c1708651bf0462692a924b9b7555e4bad0ab83c9e392c3e868557734a10e2593e527290b179da60d",
  "signature": "f47fd95ca2f81faed3c1940eaba05957321ffe57e5743ba426476cb8b685cdb6c9cd3beaa3a432543b2a1d27e9b7fd61b1d15f8d1535dc26b197255b49a33c0f"
}