{
  "id": "851c90a3-4be8-4862-9bda-08eb26d7addd",
  "type": "notarised_evidence",
  "plan_id": "33327878-9b3c-4271-89d0-dbd3f534f967",
  "agent": "bluemagma-agent",
  "action": "read:iam:list-users",
  "in_policy": true,
  "policy_reason": "matched scope read:iam:*",
  "evidence_hash_sha512": "2be06d90a8f1d986a483877a1f630a33dd0ae4ac7c5f8b166dba55244cf0d6d59e2b9691f7fac87deb8850d47ff220f9404206d31c6d19d5f13735ba7bacc633",
  "evidence": {
    "control": "SOC2 CC6.1",
    "tool": "list_iam_users",
    "args": {},
    "output": {
      "region": "us-east-1",
      "source": "aws-iam-api",
      "users": [
        {
          "name": "alice",
          "role": "admin"
        },
        {
          "name": "bob",
          "role": "engineer"
        }
      ]
    }
  },
  "observed_at": "2026-04-21T18:27:22.179065+00:00",
  "aiuc_controls": [
    "E015",
    "D003",
    "B001"
  ],
  "key_id": "50e800a98073deac",
  "agent_key_id": "",
  "policy_hash": "35e94cd5dce46628fbde88b7b1b8447c1c8a85b22e9f48d04e912b0778914a0b",
  "session_id": "34338b1c-fbde-42d1-9a1f-3f2bc17abfa7",
  "session_trajectory": [
    {
      "action": "read:iam:list-users",
      "agent": "bluemagma-agent",
      "in_policy": true,
      "observed_at": "2026-04-21T18:27:22.179065+00:00"
    }
  ],
  "plan_signature": "c109871a1204ab5feb94f010d42b2608f5f5a864dd2e6b76c1708651bf0462692a924b9b7555e4bad0ab83c9e392c3e868557734a10e2593e527290b179da60d",
  "signature": "398dce5806b3decda0bc82b6711e5e0f44d2dce2e63061c70b5dcf8cf9cdc5ba04602fe21d70d0cd68213715c927c279ce1e97122fd255397044838d651dc600"
}