{
  "id": "4da54c4a-b14f-475a-8ea4-d5e329f27507",
  "type": "notarised_evidence",
  "plan_id": "33327878-9b3c-4271-89d0-dbd3f534f967",
  "agent": "bluemagma-agent",
  "action": "read:s3:list-buckets",
  "in_policy": true,
  "policy_reason": "matched scope read:s3:*",
  "evidence_hash_sha512": "5ac6afc2126d619e1507186a6994945a89e8b316c347aba1d0e66a9e25cc568f14add3a23f1a5413681cac56a4ba04202cacf547209244eb8c35c68c293989c4",
  "evidence": {
    "control": "SOC2 CC7.2",
    "tool": "list_s3_buckets",
    "args": {},
    "output": {
      "region": "us-east-1",
      "source": "aws-s3-api",
      "buckets": [
        {
          "name": "prod-artifacts",
          "encryption": "AES256"
        }
      ]
    }
  },
  "observed_at": "2026-04-21T18:27:28.383012+00:00",
  "aiuc_controls": [
    "E015",
    "D003",
    "B001"
  ],
  "key_id": "50e800a98073deac",
  "agent_key_id": "",
  "policy_hash": "35e94cd5dce46628fbde88b7b1b8447c1c8a85b22e9f48d04e912b0778914a0b",
  "session_id": "34338b1c-fbde-42d1-9a1f-3f2bc17abfa7",
  "session_trajectory": [
    {
      "action": "read:iam:list-users",
      "agent": "bluemagma-agent",
      "in_policy": true,
      "observed_at": "2026-04-21T18:27:22.179065+00:00"
    },
    {
      "action": "read:iam:list-mfa-status",
      "agent": "bluemagma-agent",
      "in_policy": true,
      "observed_at": "2026-04-21T18:27:25.277150+00:00"
    },
    {
      "action": "read:s3:list-buckets",
      "agent": "bluemagma-agent",
      "in_policy": true,
      "observed_at": "2026-04-21T18:27:28.383012+00:00"
    }
  ],
  "previous_receipt_hash": "8503ee6e48fcaf1804a40e4d5ef49f5bf0825f7aeb637f4c60c528457466bdbf",
  "plan_signature": "c109871a1204ab5feb94f010d42b2608f5f5a864dd2e6b76c1708651bf0462692a924b9b7555e4bad0ab83c9e392c3e868557734a10e2593e527290b179da60d",
  "signature": "fdc2be3e7623b1591850e1bf5ff464dcafe0c6c1161c724821a39c9d3dbca2fea4a451567b9c78f22624780c2fa4331e0088f5393062b98a8b5e20375798aa0d"
}