{
  "id": "efa5824c-b2d5-4be0-a1a0-ca4036fa5e5b",
  "type": "notarised_evidence",
  "plan_id": "33327878-9b3c-4271-89d0-dbd3f534f967",
  "agent": "bluemagma-agent",
  "action": "change:iam:attach-policy",
  "in_policy": false,
  "policy_reason": "matched checkpoint change:iam:attach-policy",
  "evidence_hash_sha512": "b81345885495a1aaa618e1ce84eae658db5e46f9dd175712954c6f4840711b054a3331a203ded423af5f0c75fda66a82d05f1bd933f8b4259c2d7958e68b3191",
  "evidence": {
    "control": "SOC2 D003.4",
    "tool": "attach_iam_policy",
    "args": {
      "user": "bob",
      "policy": "ReadOnlyAccess"
    },
    "denial_reason": "matched checkpoint change:iam:attach-policy"
  },
  "observed_at": "2026-04-21T18:27:32.006387+00:00",
  "aiuc_controls": [
    "E015",
    "D003",
    "B001"
  ],
  "key_id": "50e800a98073deac",
  "agent_key_id": "",
  "policy_hash": "35e94cd5dce46628fbde88b7b1b8447c1c8a85b22e9f48d04e912b0778914a0b",
  "session_id": "34338b1c-fbde-42d1-9a1f-3f2bc17abfa7",
  "session_trajectory": [
    {
      "action": "read:iam:list-users",
      "agent": "bluemagma-agent",
      "in_policy": true,
      "observed_at": "2026-04-21T18:27:22.179065+00:00"
    },
    {
      "action": "read:iam:list-mfa-status",
      "agent": "bluemagma-agent",
      "in_policy": true,
      "observed_at": "2026-04-21T18:27:25.277150+00:00"
    },
    {
      "action": "read:s3:list-buckets",
      "agent": "bluemagma-agent",
      "in_policy": true,
      "observed_at": "2026-04-21T18:27:28.383012+00:00"
    },
    {
      "action": "change:iam:attach-policy",
      "agent": "bluemagma-agent",
      "in_policy": false,
      "observed_at": "2026-04-21T18:27:32.006387+00:00"
    }
  ],
  "previous_receipt_hash": "050691124920aaac26b78375dc919421f978a5e2c314602124677e9e89b0e668",
  "plan_signature": "c109871a1204ab5feb94f010d42b2608f5f5a864dd2e6b76c1708651bf0462692a924b9b7555e4bad0ab83c9e392c3e868557734a10e2593e527290b179da60d",
  "signature": "ad120cbead0eecfc4482b7e3f2f43b1fb95d85368898b977e7a51359f007266b94d817c72cfcbb9afcd9e2ca967b51bf38cd4e207e97320284db671faf385a08"
}